{
	"$schema": "./sdk-libraries.schema.json",
	"schemaVersion": 6,
	"repository": "https://github.com/mabzadev/superboard",
	"developmentBranch": "dev",
	"releasePolicy": "immutable-tag",
	"libraries": [
		{
			"id": "flutter",
			"lifecycle": "active",
			"displayName": "SuperBoard Flutter",
			"ecosystem": "Flutter",
			"packageName": "superboard_flutter",
			"sourcePath": "sdks/flutter",
			"license": "MIT",
			"licensePath": "sdks/flutter/LICENSE",
			"versionSource": "sdks/flutter/pubspec.yaml",
			"sourceVersion": "4.0.0",
			"latestReleaseVersion": "3.0.1",
			"releaseRef": "sdk-flutter-v3.0.1",
			"releaseStatus": "pending-release",
			"releaseSha": "a795e8c1ba45d82dbd036f173a48fc386346abe1",
			"install": "superboard_flutter:\n  git:\n    url: https://github.com/mabzadev/superboard.git\n    ref: sdk-flutter-v3.0.1\n    path: sdks/flutter",
			"notes": "The 4.0.0 source uses only the canonical SuperBoard API, channels, headers and environment names. Compatibility aliases have been removed. The latest published release is 3.0.1, which republishes the 3.0.0 code."
		},
		{
			"id": "flutterflow",
			"lifecycle": "active",
			"displayName": "SuperBoard FlutterFlow",
			"ecosystem": "FlutterFlow",
			"packageName": "superboard_flutterflow",
			"sourcePath": "sdks/flutterflow",
			"license": "MIT",
			"licensePath": "sdks/flutterflow/LICENSE",
			"versionSource": "sdks/flutterflow/pubspec.yaml",
			"sourceVersion": "4.0.0",
			"latestReleaseVersion": "3.0.1",
			"releaseRef": "sdk-flutterflow-v3.0.1",
			"releaseStatus": "pending-release",
			"surfaceManifest": "scripts/config/flutterflow-custom-code.json",
			"install": "superboard_flutterflow:\n  git:\n    url: https://github.com/mabzadev/superboard.git\n    ref: sdk-flutterflow-v3.0.1\n    path: sdks/flutterflow",
			"releaseSha": "a795e8c1ba45d82dbd036f173a48fc386346abe1",
			"notes": "The 4.0.0 source uses only the canonical SuperBoard API, channels, headers and environment names. Compatibility aliases have been removed. The latest published release is 3.0.1, which republishes the 3.0.0 code."
		},
		{
			"id": "web",
			"lifecycle": "active",
			"displayName": "SuperBoard Web",
			"ecosystem": "npm",
			"packageName": "@superboard/web",
			"sourcePath": "sdks/web",
			"license": "MIT",
			"licensePath": "sdks/web/LICENSE",
			"versionSource": "sdks/web/package.json",
			"sourceVersion": "0.1.0",
			"releaseStatus": "unreleased",
			"publicationTarget": "public-npm",
			"notes": "Local source; no published version or installation tag is available yet.",
			"sourcePublication": "local"
		},
		{
			"id": "tauri",
			"lifecycle": "active",
			"displayName": "SuperBoard Tauri",
			"ecosystem": "npm",
			"packageName": "@superboard/tauri",
			"sourcePath": "sdks/tauri",
			"license": "MIT",
			"licensePath": "sdks/tauri/LICENSE",
			"versionSource": "sdks/tauri/package.json",
			"sourceVersion": "0.1.0",
			"releaseStatus": "unreleased",
			"publicationTarget": "public-npm",
			"notes": "Local source; no published version or installation tag is available yet.",
			"sourcePublication": "local"
		}
	],
	"components": [
		{
			"id": "ios",
			"lifecycle": "internal",
			"displayName": "SuperBoard iOS",
			"ecosystem": "Swift",
			"packageName": "SuperBoard",
			"sourcePath": "sdks/flutter/native/ios",
			"license": "MIT",
			"licensePath": "sdks/flutter/native/ios/LICENSE",
			"versionSource": "sdks/flutter/native/ios/SuperBoard.podspec",
			"sourceVersion": "1.0.3",
			"latestReleaseVersion": "1.0.3",
			"releaseRef": "1.0.3",
			"releaseStatus": "released",
			"releaseSha": "f57894c886956f4043c0c3899c35250548937463",
			"notes": "Source identifiers use the canonical SuperBoard namespace in this checkout. Recorded release versions and commits describe historical artifacts; this renamed source has not been published under the new coordinate.",
			"install": ".package(url: \"https://github.com/mabzadev/superboard.git\", exact: \"1.0.3\")",
			"releaseSourcePath": "sdks/ios"
		},
		{
			"id": "android",
			"lifecycle": "internal",
			"displayName": "SuperBoard Android",
			"ecosystem": "Gradle",
			"packageName": "io.superboard:superboard-android-sdk",
			"sourcePath": "sdks/flutter/native/android/SuperBoard",
			"license": "MIT",
			"licensePath": "sdks/flutter/native/android/LICENSE",
			"versionSource": "sdks/flutter/native/android/SuperBoard/SuperBoard/build.gradle.kts",
			"sourceVersion": "1.0.3",
			"latestReleaseVersion": "1.0.3",
			"releaseRef": "sdk-android-v1.0.3",
			"releaseStatus": "released",
			"releaseSha": "21549c99fbe65668e0488f0f5ea2fc62219b53c4",
			"notes": "Source identifiers use the canonical SuperBoard namespace in this checkout. Recorded release versions and commits describe historical artifacts; this renamed source has not been published under the new coordinate.",
			"install": "implementation(\"io.superboard:superboard-android-sdk:1.0.3\")",
			"distribution": {
				"repository": "mabzadev/superboard-platform",
				"registryKind": "github-packages-maven",
				"registry": "https://maven.pkg.github.com/mabzadev/superboard-platform",
				"publicMetadata": true,
				"anonymousInstallable": false,
				"authentication": {
					"required": true,
					"usernameEnvironmentVariable": "SUPERBOARD_GITHUB_PACKAGES_USER",
					"tokenEnvironmentVariable": "SUPERBOARD_GITHUB_PACKAGES_TOKEN"
				}
			},
			"releaseSourcePath": "sdks/android/SuperBoard"
		},
		{
			"id": "flows-js",
			"lifecycle": "internal",
			"displayName": "SuperBoard Flows JavaScript",
			"ecosystem": "npm",
			"packageName": "@superboard/flows-js",
			"sourcePath": "sdks/web/flows/upstream/packages/js",
			"license": "MIT",
			"licensePath": "sdks/web/flows/upstream/packages/js/LICENSE",
			"versionSource": "sdks/web/flows/upstream/packages/js/package.json",
			"sourceVersion": "1.23.3",
			"releaseStatus": "unreleased",
			"publicationTarget": "workspace-only",
			"notes": "Initial reviewed source import. No npm publication, immutable release tag, release ref or release SHA exists yet."
		},
		{
			"id": "flows-react",
			"lifecycle": "internal",
			"displayName": "SuperBoard Flows React",
			"ecosystem": "npm",
			"packageName": "@superboard/flows-react",
			"sourcePath": "sdks/web/flows/upstream/packages/react",
			"license": "MIT",
			"licensePath": "sdks/web/flows/upstream/packages/react/LICENSE",
			"versionSource": "sdks/web/flows/upstream/packages/react/package.json",
			"sourceVersion": "1.26.3",
			"releaseStatus": "unreleased",
			"publicationTarget": "workspace-only",
			"notes": "Initial reviewed source import. No npm publication, immutable release tag, release ref or release SHA exists yet."
		},
		{
			"id": "flows-js-components",
			"lifecycle": "internal",
			"displayName": "SuperBoard Flows JavaScript Components",
			"ecosystem": "npm",
			"packageName": "@superboard/flows-js-components",
			"sourcePath": "sdks/web/flows/upstream/packages/js-components",
			"license": "MIT",
			"licensePath": "sdks/web/flows/upstream/packages/js-components/LICENSE",
			"versionSource": "sdks/web/flows/upstream/packages/js-components/package.json",
			"sourceVersion": "2.10.4",
			"releaseStatus": "unreleased",
			"publicationTarget": "workspace-only",
			"notes": "Initial reviewed source import. No npm publication, immutable release tag, release ref or release SHA exists yet."
		},
		{
			"id": "flows-react-components",
			"lifecycle": "internal",
			"displayName": "SuperBoard Flows React Components",
			"ecosystem": "npm",
			"packageName": "@superboard/flows-react-components",
			"sourcePath": "sdks/web/flows/upstream/packages/react-components",
			"license": "MIT",
			"licensePath": "sdks/web/flows/upstream/packages/react-components/LICENSE",
			"versionSource": "sdks/web/flows/upstream/packages/react-components/package.json",
			"sourceVersion": "2.9.4",
			"releaseStatus": "unreleased",
			"publicationTarget": "workspace-only",
			"notes": "Initial reviewed source import. No npm publication, immutable release tag, release ref or release SHA exists yet."
		},
		{
			"id": "flows-shared",
			"lifecycle": "internal",
			"displayName": "SuperBoard Flows Shared",
			"ecosystem": "npm",
			"packageName": "@superboard/flows-shared",
			"sourcePath": "sdks/web/flows/upstream/packages/shared",
			"license": "MIT",
			"licensePath": "sdks/web/flows/upstream/notices/flows-sdk-LICENSE",
			"versionSource": "sdks/web/flows/upstream/packages/shared/package.json",
			"sourceVersion": "1.0.0",
			"releaseStatus": "unreleased",
			"publicationTarget": "workspace-only",
			"notes": "Private workspace dependency bundled into the public Flows SDKs. It has no standalone registry publication, tag, release ref or release SHA."
		},
		{
			"id": "flows-styles",
			"lifecycle": "internal",
			"displayName": "SuperBoard Flows Styles",
			"ecosystem": "npm",
			"packageName": "@superboard/flows-styles",
			"sourcePath": "sdks/web/flows/upstream/packages/styles",
			"license": "MIT",
			"licensePath": "sdks/web/flows/upstream/notices/flows-sdk-LICENSE",
			"versionSource": "sdks/web/flows/upstream/packages/styles/package.json",
			"sourceVersion": "1.0.0",
			"releaseStatus": "unreleased",
			"publicationTarget": "workspace-only",
			"notes": "Private workspace stylesheet dependency bundled into the public Flows component SDKs. It has no standalone registry publication, tag, release ref or release SHA."
		}
	],
	"retiredLibraries": [
		{
			"id": "flutterflow-support",
			"lifecycle": "archived",
			"displayName": "SuperBoard FlutterFlow Support",
			"ecosystem": "FlutterFlow",
			"packageName": "superboard_flutterflow_messaging",
			"sourcePath": "sdks/flutterflow_messaging",
			"license": "MIT",
			"licensePath": "sdks/flutterflow_messaging/LICENSE",
			"versionSource": "sdks/flutterflow_messaging/pubspec.yaml",
			"sourceVersion": "1.3.0",
			"latestReleaseVersion": "1.3.0",
			"releaseRef": "sdk-flutterflow-messaging-v1.3.0",
			"releaseStatus": "released",